{
  "attempt": 31295440716,
  "base_sha": "7777777777777777777777777777777777777771",
  "case_id": "PRR-C02",
  "comparison_revision": "pr-review-c02-finding-admission-calibration-r1",
  "fixture_revision": "r2",
  "github_run_id": "31295440716",
  "head_sha": "7777777777777777777777777777777777777772",
  "measurement_qualification": {
    "action_completed": true,
    "all_agent_tokens_complete": true,
    "elapsed_time_complete": true,
    "exactly_one_relationship_reviewer": true,
    "fixture_access_observed": true,
    "fixture_permission_denials": 0,
    "relationship_reviewer_fixture_access": true,
    "relationship_reviewer_model_matches": true,
    "reported_model_matches_requested": true,
    "root_fixture_tool_access_count": 0,
    "state": "satisfied",
    "structured_output_valid": true
  },
  "model": {
    "reported": "claude-sonnet-5",
    "requested": "claude-sonnet-5"
  },
  "profile_id": "pr-review-c02-relationship-reviewer-opus-finding-admission-n1-r1",
  "quality": {
    "category_accuracy": 1,
    "clean_control_major_false_positive": 0,
    "expected_findings": 1,
    "false_negative": 0,
    "false_positive": 0,
    "line_accuracy": 1,
    "observed": true,
    "path_accuracy": 1,
    "review_contract_violation": 0,
    "scope_violation_count": 0,
    "summary_complete": true,
    "true_positive": 1
  },
  "quality_rating_contract": "pr-review-finding-quality-v9",
  "quality_score": 4,
  "relationship_reviewer_model": "opus",
  "repetition": 1,
  "result": "pass",
  "result_id": "pr-review-c02-finding-admission-calibration-r1:PRR-C02:c02-relationship-reviewer-opus-finding-admission:r1:a31295440716",
  "reviewer_executor": {
    "action": "anthropics/claude-code-action",
    "action_revision": "6b082c41935b4c8a3b8b0ef85ba4ba4d9eeb8975",
    "authentication": "claude_code_oauth_token",
    "claude_cli": "reported_by_action",
    "runner": "ubuntu-latest",
    "session_mode": "one_root_action_with_exactly_one_relationship_reviewer_per_case"
  },
  "runtime": {
    "input_tokens": 763539,
    "output_tokens": 286,
    "reported_cost_usd": 1.05153175,
    "total_tokens": 763825,
    "turns": 3
  },
  "schema_version": 18,
  "timing": {
    "action_step_ms": 218789,
    "e2e_ms": null,
    "execution_ms": 218789,
    "input_ms": 1810,
    "queue_ms": null,
    "report_ms": null,
    "review_ms": 202197,
    "setup_ms": null
  },
  "variant": "c02-relationship-reviewer-opus-finding-admission",
  "workflow_revision": "pr-review-calibrate-c02-finding-admission-r1",
  "workflow_trace": {
    "agent_model_groups": [
      [
        "opus"
      ]
    ],
    "all_agent_input_tokens": 763539,
    "all_agent_output_tokens": 286,
    "complete": true,
    "fixture_tool_access_count": 18,
    "fixture_tool_access_observed": true,
    "fixture_tool_permission_denials": 0,
    "hook_event_count": 48,
    "permission_denials_by_tool": {},
    "relationship_reviewer_fixture_access_count": 18,
    "relationship_reviewer_ids_observed": 1,
    "relationship_reviewer_model_matches": true,
    "root_fixture_tool_access_count": 0,
    "subagent_start_count": 1,
    "subagent_stop_count": 1,
    "subagent_usage_observed": true,
    "usage_records": 30
  }
}
